{
  "schema_version": 2,
  "workflow": "cyclopus-api-platform-v1",
  "phase": "phase-5",
  "gate": "unit",
  "gate_type": "unit",
  "status": "passed",
  "attempt": 1,
  "started_at": "2026-07-31T06:06:15Z",
  "finished_at": "2026-07-31T06:06:18Z",
  "source_revision": "1afb08a4d9e3d9ce24298a214ce4c80079f4361f",
  "input_digest": "2df89cc51a04224a14dae63edafecdc6d1dff69f94131a717e698ece5498a610",
  "implementer_agent": "infrastructure-dr-implementer",
  "command": "./scripts/test_infrastructure.sh",
  "exit_code": 0,
  "profile": "local",
  "artifacts": [
    "infra/opentofu",
    "charts/cyclopus",
    "infra/bootstrap",
    "infra/backup"
  ],
  "notes": "tofu fmt+validate passed helm lint+template passed script syntax/shellcheck passed capacity-gate + version-pin logic checks passed"
}