{
  "schema_version": 2,
  "workflow": "cyclopus-api-platform-v1",
  "phase": "phase-5",
  "gate": "ovh-capability-decision",
  "gate_type": "evidence",
  "status": "blocked",
  "attempt": 1,
  "started_at": "2026-07-31T06:06:30Z",
  "finished_at": "2026-07-31T06:06:30Z",
  "source_revision": "1afb08a4d9e3d9ce24298a214ce4c80079f4361f",
  "input_digest": "729e0e69438bc2c3011dbb2f94efb38affb72d448f3b3edce1d98939c0adb918",
  "implementer_agent": "infrastructure-dr-implementer",
  "command": "./scripts/integration.sh ovh-capabilities",
  "exit_code": 2,
  "artifacts": [
    "infra/opentofu"
  ],
  "notes": "blocking_reason: live OVH Public Cloud credentials unavailable in this environment. Offline tofu validate/fmt for this module is covered by scripts/test_infrastructure.sh (unit gate)."
}